<?xml version="1.0"?>
<simulation xmlns:xsi="http://www.w3.org/2001/XMLSchema-instance"
            xsi:noNamespaceSchemaLocation="../src/XMLInput/simulation.xsd">


  <parameter>
    <start-time>0</start-time>
    <end-time>5</end-time>
    <delta-t>0.0002</delta-t>
    
    <force-calculator>
      <type>lennard-jones</type>
      <epsilon>5</epsilon>
      <sigma>1</sigma>
    </force-calculator>
    
    <simulation-mode>
      <type>normal</type>
    </simulation-mode>
  </parameter>
  
  
  <input>
    <cuboid_file>examples/eingabe-cuboid1.txt</cuboid_file>
  </input>
  
  
  <output>
    <base_filename>MD_vtk</base_filename>
    <output_freq>10</output_freq>
  </output>
  
  
</simulation>

